{
  "report_type": "policy-evaluation-report",
  "recorded_at": "2026-06-15T14:00:00.103Z",
  "evaluation_id": "PER-MQFA5KYV-990D1J",
  "subject_ref": "SESS-MQFA5KYG-EOPJNS",
  "evaluation_scope": "runtime loop proof allocation review",
  "policy_refs": [
    "policy-main-branch-access"
  ],
  "overall_outcome": "allowed",
  "results": [
    {
      "policy_id": "policy-main-branch-access",
      "effect": "require-review",
      "outcome": "allowed",
      "reason": "The proof stays inside reviewed local runtime artifacts rather than autonomous execution.",
      "blocking": false
    }
  ],
  "recommended_actions": [
    "Proceed with the reviewed runtime proof slice and keep execution auditable."
  ],
  "source_task_id": "TASK-011",
  "source_parent_session_id": "SESS-MQFA5KYG-EOPJNS",
  "source_decision_record_id": "DEC-MQFA5KYM-YUUJPN"
}
