{
  "report_type": "policy-evaluation-report",
  "recorded_at": "2026-06-15T15:54:38.385Z",
  "evaluation_id": "PER-MQFE90A9-MNLXXK",
  "subject_ref": "SESS-MQFE909H-T3ZB5Z",
  "evaluation_scope": "runtime loop proof allocation review",
  "policy_refs": [
    "policy-main-branch-access"
  ],
  "overall_outcome": "allowed",
  "results": [
    {
      "policy_id": "policy-main-branch-access",
      "effect": "require-review",
      "outcome": "allowed",
      "reason": "The proof stays inside reviewed local runtime artifacts rather than autonomous execution.",
      "blocking": false
    }
  ],
  "recommended_actions": [
    "Proceed with the reviewed runtime proof slice and keep execution auditable."
  ],
  "source_task_id": "TASK-034",
  "source_parent_session_id": "SESS-MQFE909H-T3ZB5Z",
  "source_decision_record_id": "DEC-MQFE909X-6YSR2N"
}
